{
  "schema_version": "1.0",
  "familien": [
    "rolle",
    "wert",
    "zaehlung",
    "netz",
    "frische",
    "aenderung"
  ],
  "frische_sekunden": 300,
  "rollen": {
    "pv": "PV-Produktion",
    "consumer": "Verbrauch",
    "grid": "Netz",
    "keine": "keine Rolle"
  },
  "gruende": [
    "kein_wert",
    "veraltet",
    "kein_geraet",
    "archiviert",
    "unvollstaendig"
  ],
  "protokoll": [
    "rolle_gesetzt",
    "rolle_entzogen"
  ],
  "kundenwort": "Summenwert",
  "verbotene_woerter": [
    "Gesamtwert",
    "PV gesamt",
    "Helfer"
  ],
  "cases": {
    "rolle": [
      {
        "name": "pv",
        "input": {
          "rolle": "pv"
        },
        "expected": {
          "erlaubt": true,
          "zuordnen": true,
          "wort": "PV-Produktion",
          "gesetz": "summe"
        }
      },
      {
        "name": "consumer",
        "input": {
          "rolle": "consumer"
        },
        "expected": {
          "erlaubt": true,
          "zuordnen": true,
          "wort": "Verbrauch",
          "gesetz": "summe"
        }
      },
      {
        "name": "grid",
        "input": {
          "rolle": "grid"
        },
        "expected": {
          "erlaubt": true,
          "zuordnen": true,
          "wort": "Netz",
          "gesetz": "einzelwert"
        }
      },
      {
        "name": "keine",
        "input": {
          "rolle": "keine"
        },
        "expected": {
          "erlaubt": true,
          "zuordnen": false,
          "wort": "keine Rolle",
          "gesetz": "keine"
        }
      },
      {
        "name": "abgelehnt-storage",
        "input": {
          "rolle": "storage"
        },
        "expected": {
          "erlaubt": false,
          "zuordnen": false,
          "wort": null,
          "gesetz": null
        }
      },
      {
        "name": "abgelehnt-charging",
        "input": {
          "rolle": "charging"
        },
        "expected": {
          "erlaubt": false,
          "zuordnen": false,
          "wort": null,
          "gesetz": null
        }
      },
      {
        "name": "abgelehnt-charging-own",
        "input": {
          "rolle": "charging-own"
        },
        "expected": {
          "erlaubt": false,
          "zuordnen": false,
          "wort": null,
          "gesetz": null
        }
      },
      {
        "name": "abgelehnt-PV",
        "input": {
          "rolle": "PV"
        },
        "expected": {
          "erlaubt": false,
          "zuordnen": false,
          "wort": null,
          "gesetz": null
        }
      },
      {
        "name": "abgelehnt-",
        "input": {
          "rolle": ""
        },
        "expected": {
          "erlaubt": false,
          "zuordnen": false,
          "wort": null,
          "gesetz": null
        }
      },
      {
        "name": "abgelehnt-None",
        "input": {
          "rolle": null
        },
        "expected": {
          "erlaubt": false,
          "zuordnen": false,
          "wort": null,
          "gesetz": null
        }
      },
      {
        "name": "Objekt-Prototyp ist keine Rolle",
        "input": {
          "rolle": "toString"
        },
        "expected": {
          "erlaubt": false,
          "zuordnen": false,
          "wort": null,
          "gesetz": null
        }
      }
    ],
    "wert": [
      {
        "name": "kanal",
        "input": {
          "quelle": {
            "entity_id": "K-1",
            "point_key": "power",
            "quell_messstelle_id": null
          }
        },
        "expected": true
      },
      {
        "name": "summe",
        "input": {
          "quelle": {
            "entity_id": null,
            "point_key": null,
            "quell_messstelle_id": "MS-S1"
          }
        },
        "expected": true
      },
      {
        "name": "beides",
        "input": {
          "quelle": {
            "entity_id": "K-1",
            "point_key": "power",
            "quell_messstelle_id": "MS-S1"
          }
        },
        "expected": false
      },
      {
        "name": "nichts",
        "input": {
          "quelle": {
            "entity_id": null,
            "point_key": null,
            "quell_messstelle_id": null
          }
        },
        "expected": false
      },
      {
        "name": "halber-kanal",
        "input": {
          "quelle": {
            "entity_id": "K-1",
            "point_key": null,
            "quell_messstelle_id": null
          }
        },
        "expected": false
      },
      {
        "name": "leer",
        "input": {
          "quelle": {
            "entity_id": "K-1",
            "point_key": " ",
            "quell_messstelle_id": null
          }
        },
        "expected": false
      }
    ],
    "zaehlung": [
      {
        "name": "PV-Bestand: ohne Zuordnung bleibt der Rückfall",
        "input": {
          "anlage": "AN-1",
          "rolle": "pv",
          "jetzt": "2026-09-16T10:05:00Z",
          "zuordnungen": []
        },
        "expected": {
          "zuordnung_vorhanden": false,
          "wert": null,
          "unvollstaendig": false,
          "stand": null,
          "beitragend": 0,
          "gesamt": 0,
          "gezaehlt": [],
          "fehler": null
        }
      },
      {
        "name": "PV-Bestand: zwei frische Geräte",
        "input": {
          "anlage": "AN-1",
          "rolle": "pv",
          "jetzt": "2026-09-16T10:05:00Z",
          "zuordnungen": [
            {
              "anlage": "AN-1",
              "rolle": "pv",
              "geraet": "GR-1",
              "quelle": {
                "entity_id": "K-1",
                "point_key": "power",
                "quell_messstelle_id": null
              },
              "enthaelt": [],
              "zustand": {
                "wert": 10,
                "stand": "2026-09-16T10:00:00Z",
                "grund": null
              }
            },
            {
              "anlage": "AN-1",
              "rolle": "pv",
              "geraet": "GR-2",
              "quelle": {
                "entity_id": "K-2",
                "point_key": "power",
                "quell_messstelle_id": null
              },
              "enthaelt": [],
              "zustand": {
                "wert": 5,
                "stand": "2026-09-16T10:00:00Z",
                "grund": null
              }
            }
          ]
        },
        "expected": {
          "zuordnung_vorhanden": true,
          "wert": 15,
          "unvollstaendig": false,
          "stand": "2026-09-16T10:00:00Z",
          "beitragend": 2,
          "gesamt": 2,
          "gezaehlt": [
            {
              "entity_id": "K-1",
              "point_key": "power",
              "quell_messstelle_id": null
            },
            {
              "entity_id": "K-2",
              "point_key": "power",
              "quell_messstelle_id": null
            }
          ],
          "fehler": null
        }
      },
      {
        "name": "PV-Bestand: benannte Teilsumme, kein Ersatz durch Null",
        "input": {
          "anlage": "AN-1",
          "rolle": "pv",
          "jetzt": "2026-09-16T10:05:00Z",
          "zuordnungen": [
            {
              "anlage": "AN-1",
              "rolle": "pv",
              "geraet": "GR-1",
              "quelle": {
                "entity_id": "K-1",
                "point_key": "power",
                "quell_messstelle_id": null
              },
              "enthaelt": [],
              "zustand": {
                "wert": 10,
                "stand": "2026-09-16T10:00:00Z",
                "grund": null
              }
            },
            {
              "anlage": "AN-1",
              "rolle": "pv",
              "geraet": "GR-2",
              "quelle": {
                "entity_id": "K-2",
                "point_key": "power",
                "quell_messstelle_id": null
              },
              "enthaelt": [],
              "zustand": {
                "wert": null,
                "stand": null,
                "grund": "kein_wert"
              }
            }
          ]
        },
        "expected": {
          "zuordnung_vorhanden": true,
          "wert": 10,
          "unvollstaendig": true,
          "stand": "2026-09-16T10:00:00Z",
          "beitragend": 1,
          "gesamt": 2,
          "gezaehlt": [
            {
              "entity_id": "K-1",
              "point_key": "power",
              "quell_messstelle_id": null
            },
            {
              "entity_id": "K-2",
              "point_key": "power",
              "quell_messstelle_id": null
            }
          ],
          "fehler": null
        }
      },
      {
        "name": "PV-Bestand: alle stumm, keine Null",
        "input": {
          "anlage": "AN-1",
          "rolle": "pv",
          "jetzt": "2026-09-16T10:05:00Z",
          "zuordnungen": [
            {
              "anlage": "AN-1",
              "rolle": "pv",
              "geraet": "GR-1",
              "quelle": {
                "entity_id": "K-1",
                "point_key": "power",
                "quell_messstelle_id": null
              },
              "enthaelt": [],
              "zustand": {
                "wert": null,
                "stand": null,
                "grund": "kein_wert"
              }
            }
          ]
        },
        "expected": {
          "zuordnung_vorhanden": true,
          "wert": null,
          "unvollstaendig": true,
          "stand": null,
          "beitragend": 0,
          "gesamt": 1,
          "gezaehlt": [
            {
              "entity_id": "K-1",
              "point_key": "power",
              "quell_messstelle_id": null
            }
          ],
          "fehler": null
        }
      },
      {
        "name": "Null ist ein gelieferter Wert",
        "input": {
          "anlage": "AN-1",
          "rolle": "pv",